{
    "alerts": {
        "resourceNotFound": {
            "description": "Please update to a valid resource.",
            "title": "The resource linked to this rule is no longer available."
        }
    },
    "buttons": {
        "and": "And",
        "clearRule": "Clear Rule",
        "newRule": "New Rule",
        "or": "Or"
    },
    "fields": {
        "autocomplete": {
            "clearFilterActionText": "Clear search value to see more",
            "inputPlaceholderText": "Please type to enter a resource ...",
            "moreItemsMessage": "Only the recent resources are listed. Type to search for others ...",
            "placeholderText": "Please select a resource or type to search ...",
            "selectPlaceholderText": "Please select a resource"
        }
    },
    "texts": {
        "execute": "Execute",
        "if": "If"
    }
}
